### ISSUE TITLE
Partial working with v2.0, not working with v3.1

### ISSUE THREAD

**Issue by sjkjs** [tommyjlong/app_rtsp_sip#7]
Hi,

I was previously using v2.0 with a Hikvision KV6133 doorbell which was working well, no issues at all.

I recently bought a new Hikvision KV6114 and was unable to get it to work. When using all the same configuration and settings as I was with the old KV6133, this module would crash immediately with the error RecvResponse: Error receiving response [0,0].Success

I noticed that you had released a couple of newer versions so I recompiled and upgraded to the latest v3.1 but now neither of the doorbells are working anymore.

With the KV6133 (the one that used to work) I get this in the Asterisk logs:

```
[2026-01-18 11:40:56] NOTICE[18963][C-00000063]: app_rtsp_sip.c:3574 main_loop: app_rtsp_sip version = 3.1
[2026-01-18 11:40:56] NOTICE[18963][C-00000063]: app_rtsp_sip.c:3576 main_loop: >rtsp-sip main loop
[2026-01-18 11:40:56] WARNING[18963][C-00000063]: app_rtsp_sip.c:3010 CreateSDP:     peer rtp port is not provided
[2026-01-18 11:40:56] ERROR[18963][C-00000063]: app_rtsp_sip.c:3481 RecvResponse: Error receiving response [-1,104].Connection reset by peer
[2026-01-18 11:40:56] ERROR[18963][C-00000063]: app_rtsp_sip.c:2155 SendRequest: Error sending request [32]
[2026-01-18 11:40:56] ERROR[18963][C-00000063]: app_rtsp_sip.c:3481 RecvResponse: Error receiving response [0,0].Success
[2026-01-18 11:40:56] NOTICE[18963][C-00000063]: app_rtsp_sip.c:5228 main_loop: <rtsp-sip main loop
[2026-01-18 11:40:58] ERROR[18367][C-00000060]: app_rtsp_sip.c:3729 main_loop: ast_read() failed. Bail out!
[2026-01-18 11:40:58] NOTICE[18367][C-00000060]: app_rtsp_sip.c:5228 main_loop: <rtsp-sip main loop
```

And this if I do a tcpdump:

```
11:43:21.872629 IP pbx.56956 > intercom-door.rtsp: Flags [S], seq 2064977076, win 29200, options [mss 1460,sackOK,TS val 2443633 ecr 0,nop,wscale 7], length 0
11:43:21.873083 IP intercom-door.rtsp > pbx.56956: Flags [S.], seq 123888653, ack 2064977077, win 65160, options [mss 1460,sackOK,TS val 2856178753 ecr 2443633,nop,wscale 5], length 0
11:43:21.873128 IP pbx.56956 > intercom-door.rtsp: Flags [.], ack 1, win 229, options [nop,nop,TS val 2443633 ecr 2856178753], length 0
11:43:21.873306 IP pbx.56956 > intercom-door.rtsp: Flags [P.], seq 1:118, ack 1, win 229, options [nop,nop,TS val 2443634 ecr 2856178753], length 117: RTSP: DESCRIBE rtsp://10.14.3.3/Streaming/Channels/102 RTSP/1.0
11:43:21.873525 IP intercom-door.rtsp > pbx.56956: Flags [.], ack 118, win 2033, options [nop,nop,TS val 2856178754 ecr 2443634], length 0
11:43:21.889964 IP intercom-door.rtsp > pbx.56956: Flags [P.], seq 1:296, ack 118, win 2033, options [nop,nop,TS val 2856178770 ecr 2443634], length 295: RTSP: RTSP/1.0 401 Unauthorized
11:43:21.890031 IP pbx.56956 > intercom-door.rtsp: Flags [.], ack 296, win 237, options [nop,nop,TS val 2443650 ecr 2856178770], length 0
11:43:21.890166 IP pbx.56956 > intercom-door.rtsp: Flags [P.], seq 118:282, ack 296, win 237, options [nop,nop,TS val 2443650 ecr 2856178770], length 164: RTSP: DESCRIBE rtsp://10.14.3.3/Streaming/Channels/102 RTSP/1.0
11:43:21.895650 IP intercom-door.rtsp > pbx.56956: Flags [P.], seq 296:993, ack 282, win 2028, options [nop,nop,TS val 2856178776 ecr 2443650], length 697: RTSP: RTSP/1.0 200 OK
11:43:21.895826 IP pbx.56956 > intercom-door.rtsp: Flags [P.], seq 282:482, ack 993, win 248, options [nop,nop,TS val 2443656 ecr 2856178776], length 200: RTSP: SETUP rtsp://10.14.3.3/Streaming/Channels/102/trackID=2 RTSP/1.0
11:43:21.903336 IP intercom-door.rtsp > pbx.56956: Flags [P.], seq 993:1197, ack 482, win 2022, options [nop,nop,TS val 2856178784 ecr 2443656], length 204: RTSP: RTSP/1.0 200 OK
11:43:21.903486 IP pbx.56956 > intercom-door.rtsp: Flags [P.], seq 482:709, ack 1197, win 259, options [nop,nop,TS val 2443664 ecr 2856178784], length 227: RTSP: SETUP rtsp://10.14.3.3/Streaming/Channels/102/trackID=1 RTSP/1.0
11:43:21.914813 IP intercom-door.rtsp > pbx.56956: Flags [R.], seq 1197, ack 709, win 2015, options [nop,nop,TS val 2856178795 ecr 2443664], length 0
```

And with the KV6114 (the one which already didn't work even on v2.0), the Asterisk log shows:

```
[2026-01-18 11:47:40] NOTICE[21682][C-00000072]: app_rtsp_sip.c:3574 main_loop: app_rtsp_sip version = 3.1
[2026-01-18 11:47:40] NOTICE[21682][C-00000072]: app_rtsp_sip.c:3576 main_loop: >rtsp-sip main loop
```

There doesn't seem to be any further app_rtsp_sip log entries after this until I end the call.

And tcpdump shows:

```
11:39:40.269099 IP pbx.40172 > intercom-gate.rtsp: Flags [S], seq 1547723880, win 29200, options [mss 1460,sackOK,TS val 2222029 ecr 0,nop,wscale 7], length 0
11:39:40.269440 IP intercom-gate.rtsp > pbx.40172: Flags [S.], seq 1053028571, ack 1547723881, win 65160, options [mss 1460,sackOK,TS val 1465442677 ecr 2222029,nop,wscale 5], length 0
11:39:40.269494 IP pbx.40172 > intercom-gate.rtsp: Flags [.], ack 1, win 229, options [nop,nop,TS val 2222030 ecr 1465442677], length 0
11:39:40.269847 IP pbx.40172 > intercom-gate.rtsp: Flags [P.], seq 1:118, ack 1, win 229, options [nop,nop,TS val 2222030 ecr 1465442677], length 117: RTSP: DESCRIBE rtsp://10.14.3.1/Streaming/Channels/102 RTSP/1.0
11:39:40.270152 IP intercom-gate.rtsp > pbx.40172: Flags [.], ack 118, win 2033, options [nop,nop,TS val 1465442678 ecr 2222030], length 0
11:39:40.272001 IP intercom-gate.rtsp > pbx.40172: Flags [P.], seq 1:300, ack 118, win 2033, options [nop,nop,TS val 1465442680 ecr 2222030], length 299: RTSP: RTSP/1.0 401 Unauthorized
11:39:40.272029 IP pbx.40172 > intercom-gate.rtsp: Flags [.], ack 300, win 237, options [nop,nop,TS val 2222032 ecr 1465442680], length 0
11:39:40.272247 IP pbx.40172 > intercom-gate.rtsp: Flags [P.], seq 118:282, ack 300, win 237, options [nop,nop,TS val 2222033 ecr 1465442680], length 164: RTSP: DESCRIBE rtsp://10.14.3.1/Streaming/Channels/102 RTSP/1.0
11:39:40.276256 IP intercom-gate.rtsp > pbx.40172: Flags [P.], seq 300:599, ack 282, win 2028, options [nop,nop,TS val 1465442684 ecr 2222033], length 299: RTSP: RTSP/1.0 401 Unauthorized
11:39:40.276403 IP pbx.40172 > intercom-gate.rtsp: Flags [P.], seq 282:446, ack 599, win 245, options [nop,nop,TS val 2222037 ecr 1465442684], length 164: RTSP: DESCRIBE rtsp://10.14.3.1/Streaming/Channels/102 RTSP/1.0
11:39:40.277762 IP intercom-gate.rtsp > pbx.40172: Flags [P.], seq 599:898, ack 446, win 2023, options [nop,nop,TS val 1465442686 ecr 2222037], length 299: RTSP: RTSP/1.0 401 Unauthorized
11:39:40.277880 IP pbx.40172 > intercom-gate.rtsp: Flags [P.], seq 446:610, ack 898, win 254, options [nop,nop,TS val 2222038 ecr 1465442686], length 164: RTSP: DESCRIBE rtsp://10.14.3.1/Streaming/Channels/102 RTSP/1.0
11:39:40.280073 IP intercom-gate.rtsp > pbx.40172: Flags [P.], seq 898:1197, ack 610, win 2018, options [nop,nop,TS val 1465442688 ecr 2222038], length 299: RTSP: RTSP/1.0 401 Unauthorized
```

This repeats over and over until the call ends.

The username and password are definitely correct and the RTSP URL works perfectly if I put it into VLC.

This is how I'm calling RTSP-SIP:

`RTSP-SIP(rtsp://admin:password@10.14.3.1:554/Streaming/Channels/102,0,,5060)`

This is all under Asterisk 18.26.4. It would be pretty difficult to try a different Asterisk version as it's running inside FreePBX and it's all tightly integrated.

I'm at a bit of a loss as to what else I can try. Any help would be appreciated.
